date,title,articles,url,,,,,,,,
,Voyager 2 Gets a Life-Extending Power Boost in Deep Space,"NASA ENGINEERS HAVE come up with a power-saving strategy to eke more time—and more science—out of the Voyager probes, humanity’s longest-running spacecraft, as they continue venturing into unexplored reaches of interstellar space.

And time is of the essence: Voyager 1 and 2 have been flying since 1977, and their power sources have been gradually fading, putting their instruments at risk. Out in the vast abyss of deep space, unfathomably far from our sun, solar power isn’t viable. That’s why engineers equipped each Voyager with a trio of radioisotope thermoelectric generators, or RTGs. These work by converting the heat from the decay of radioisotope fuel, plutonium-238, into electricity. They’re basically nuclear batteries—and they’re finally running out of juice, losing a predictable 4 watts per year. While the Voyagers don’t need that power for propulsion, it’s essential to their ability to collect scientific readings of far-flung charged particles and magnetic fields—so far, humanity’s only opportunity to sample that data in interstellar space.

A couple of years ago, NASA began exploring ways to keep the Voyagers’ instruments running as long as possible. The first move, in 2019, was to start turning off the heaters for the science instruments. That worked; the devices kept working despite temperatures dropping some 50 degrees Celsius, much colder than the conditions they’d been tested in. But it still wasn’t enough, so at the end of March, a NASA team initiated an energy-saving strategy on Voyager 2 that dips into some reserve power meant to protect systems from voltage spikes.

FEATURED VIDEO

 

While this strategy does leave the craft more vulnerable, the risk of such spikes seems to be very low, says Suzanne Dodd, the Voyager project manager at NASA’s Jet Propulsion Laboratory in Southern California. Assuming all goes well, they’ll start similar voltage management on Voyager 1 as early as this fall. Altogether, Dodd thinks this could buy the probes’ science mission a few extra years. Voyager is still a mission of discovery, she says, and every piece of data the spacecraft obtain in interstellar space is valuable. “I continue to be amazed by these spacecraft and by the engineers who come up with clever ways to operate them,” says Dodd.

Now 45 years old, the Voyagers spent their first two decades flying through the solar system, snapping photos of Jupiter, Saturn, Uranus, and Neptune as they zoomed by. Voyager 1 also captured the iconic “pale blue dot” photograph of a tiny, distant Earth. As they kept going, they continued capturing data. They have long outlived their predecessors, Pioneer 10 and 11, which were the first probes to fly by the gas giants but shut down more than 20 years ago. Both Voyagers have flown well beyond the Kuiper belt, a region hosting Pluto and other small, icy bodies. In 2012, Voyager 1 left the heliosphere, the protective bubble of particles and magnetic fields generated by the sun, beyond which lies the interstellar medium. Its twin followed six years later, at which point both were officially in interstellar territory, cruising at 35,000 miles per hour into the unknown.

Today, Voyager 1 is 159 astronomical units from home, and Voyager 2 is at 133 AU, traveling in a different direction. (1 AU is the distance between the Earth and sun, or about 93 million miles.) The spacecraft are surely showing signs of age—the team dealt with telemetry problems on Voyager 1 last year—but the cosmic workhorses are continuing on.",https://www.wired.com/story/voyager-2-gets-a-life-extending-power-boost-in-deep-space/,,,,,,,,
5/8/2023 7:00,Hollywood’s Screenwriters Are Right to Fear AI,"ONE OF THE more harrowing reads for writers concerned about artificial intelligence encroaching on their livelihoods is a study commissioned by OpenAI itself. Published in March, it places writers in the “fully exposed” category. This means that, according to OpenAI, a large language model (LLM) could reduce the time it takes for them to carry out their work by at least 50 percent. AI can already score in the 93rd percentile on SAT reading exams; it can already produce bad stories and poems. Directors are discussing the possibilities of AI-generated scripts.

It’s no wonder, then, that the Writers Guild of America is demanding a greater say in how AI is used in Hollywood.

TALK IS CHEAP
ChatGPT’s API Is Here. Let the AI Gold Rush Begin

CHRIS STOKEL-WALKER

MUSIC
Musicians, Machines, and the AI-Powered Future of Sound

WILL BEDINGFIELD

YIPPEE KI-YAY
The Bruce Willis Deepfake Is Everyone’s Problem

WILL BEDINGFIELD

When WGA members began their picket on May 2, the first such strike in 15 years, focus was on streaming services’ impact on Hollywood and how the residuals paid to writers for streaming projects hadn’t kept pace with those of traditional broadcast shows and theatrical releases. But there was another demand: that the agreement with studios “regulate use of material produced using artificial intelligence or similar technologies.”

FEATURED VIDEO

 

The Writers Guild isn’t alone in trying to figure out AI’s place in its industry. Artists, actors, musicians—people in all creative professions—are trying to wrest control of the technology before it is used against them. It’s a smart move. If the history of automation has demonstrated anything, it’s that leaving the implementation of new technologies up to management is a bad idea.

Over the phone, John August, a member of the WGA’s negotiating committee and writer of Charlie's Angels, explains that the proposal “says that material generated by AI or similar technologies is not considered literary material or source material for the purposes of the contract.” In this context, literary material refers to the stuff writers get paid to write: screenplays, treatments, outlines. Provisions over source material, on the other hand, seek to ensure that writers will not be asked to adapt AI-generated scripts—trained on human writers’ work—as they might with a novel. In both of those scenarios, writers’ employment and pay shrinks. The Alliance of Motion Picture and Television Producers rejected this proposal, offering “annual meetings to discuss advancements in technology.”

With emerging tech, things rarely happen as advertised. This is particularly germane to LLMs, where the scope of possible ends still ranges from flash-in-the-pan productivity tools to society-upending sci-fi intelligence. Skeptics often bring up self-driving cars, baptized in hype a decade ago but still not flooding the roads or outmoding truck drivers.

Nonetheless, generative AI’s current trajectory conjures inescapable parallels with the encroachment of streaming services on the Hollywood system. August recalls that at the time of the 2007 WGA strike, the major streaming services hadn’t yet taken off. He had, however, begun to notice the stirrings of deep sea change, portended by innovations like spin-off “webisodes” of The Office being thrown onto the internet.

“We saw that this might be the next way that companies would be able to make money off of our work,” he says. “So that strike was largely about making sure that, no matter what the medium was, our content still was paid for upfront in a fair way and paid for in the back end through residuals. We didn’t know what streaming was going to become. But we knew the internet was going to be the future.”",https://www.wired.com/story/hollywood-screenwriters-artificial-intelligence-guardrails/,,,,,,,,
5/8/2023 6:00,Data Broker That Targeted Abortion Clinics Gets Military Contract,"THE DATA BROKER made famous for selling location data related to abortion clinic visits has signed a contract with the US Air Force and plans to provide information about “sensitive places” and “adversary state-owned enterprises” around the world, according to records obtained by WIRED. The company, SafeGraph, told the military that its data can be used for “analyzing human activity for landing zone selection,” as well as to identify hospitals, schools, and houses of worship to “help avoid collateral damage.”

As part of a $74,888 “Phase 1” contract with AFWERX, the “innovation wing” of the Air Force, SafeGraph discussed its products with multiple Air Force end-users between November 2022 and February 2023. At the end of the contract, SafeGraph told officials that it had identified several potential customers and planned to adapt its products for larger military partnerships later this year.

SafeGraph did not respond to multiple requests to comment.

In a Google form submitted to the Air Force after its Phase 1 contract ended on February 12, 2023, SafeGraph submitted a slide deck, a one-page marketing pitch, and answers to a series of questions about its experience and plans for future work with the US Department of Defense. The records primarily describe the military needs SafeGraph hopes to fill.

FEATURED VIDEO

 

The thrust of the slide deck is SafeGraph’s ability to provide data about the affiliation of, and activity around, physical locations across the globe. And SafeGraph appears to believe its data is suitable for use in the Air Force’s most high-stakes decisions. On one slide, titled “Defense Need—Identify Sensitive Places to Avoid,” the company explains that its data can “help avoid collateral damage” by identifying hospitals, schools, embassies, and houses of worship. Another record claims it can “Build a No-Strike List at Machine Speed.”

Air strikes on “sensitive places” and civilians have happened repeatedly during US military action in the 21st century. In 2015, US air strikes accidentally destroyed a Doctors Without Borders hospital in Kunduz, Afghanistan, killing more than 40 people; a 2021 drone attack in Kabul killed 10 civilians, including seven children, and was called a “tragic mistake” by US officials. A trove of Pentagon documents assessing the thousands of civilians killed by US bombing in the Middle East point to faulty intelligence and breakdowns in surveillance. Now, SafeGraph is proposing that its location data, historically intended for marketers and hedge funds, can help limit that kind of catastrophic collateral damage.",https://www.wired.com/story/safegraph-us-air-force-location-data/,,,,,,,,
5/8/2023 3:00,This Asus Router Is the Best Wi-Fi 6E Option for Most People,"THE ASUS RT-AXE7800 is a tri-band router that supports the newly opened 6-GHz band, making it a smart choice for congested homes. Asus has packed a comprehensive list of features and configuration options into this slick hexagonal design. If you crave control over your network and want a router that covers all the bases for an up-front price, it may just put a hex on you.

As Wi-Fi 7 creeps closer, Wi-Fi 6E routers are growing more affordable. The list price on the Asus RT-AXE7800 is $330, but we are already seeing discounts. There are some compelling reasons to wait for Wi-Fi 7, which is set to unlock the potential of that 6-GHz band and improve its currently disappointing range. But for folks in smaller homes and apartments with local interference woes, the Asus RT-AXE7800 could offer tangible benefits.

Complete Package
PHOTOGRAPH: ASUS

After unpacking the surprisingly compact Asus RT-AXE7800 and unfolding its six antennas, it took me just five minutes to set up. Every time I test an Asus router, I am impressed by the wealth of options and the inclusion of things like robust network security and comprehensive parental controls without a subscription. You can even set up and use the Asus RT-AXE7800 without creating a user account with Asus.

Connectivity is generous and highly configurable. The main WAN/LAN port is rated at 2.5 Gbps, there’s a second 1-Gbps WAN/LAN, and a further three 1-Gbps ports, with support for link aggregation (combining ports for faster wired connections). There’s also a single USB 3.0 port.

If you like to tinker, Asus offers a wealth of options in the mobile app and via the browser interface. You can split bands, set up priority activities (gaming, streaming, working) with the adaptive QoS, and create a mesh network with other AiMesh Asus routers. There’s also support for VPN services, Dynamic DNS, router settings backup, traffic analysis, and all sorts of network tools. Most folks won’t need to fiddle with these settings, but it’s better to have the option.

PHOTOGRAPH: ASUS",https://www.wired.com/review/asus-rt-axe7800/,,,,,,,,
5/8/2023 2:00,The Global Battle to Regulate AI Is Just Beginning,"DAN NECHITA HAS spent the past year shuttling back and forth between Brussels and Strasbourg. As the head of cabinet (essentially chief of staff) for one of the two rapporteurs leading negotiations over the EU's proposed new AI law, he's helped hammer out compromises between those who want the technology to be tightly regulated and those who believe innovation needs more space to evolve.

The discussions have, Nechita says, been “long and tedious.” First there were debates about how to define AI—what it was that Europe was even regulating. “That was a very, very, very long discussion,” Nechita says. Then there was a split over what uses of AI were so dangerous they should be banned or categorized as high-risk. “We had an ideological divide between those who would want almost everything to be considered high-risk and those who would prefer to keep the list as small and precise as possible.”

But those often tense negotiations mean that the European Parliament is getting closer to a sweeping political agreement that would outline the body’s vision for regulating AI. That agreement is likely to include an outright ban on some uses of AI, such as predictive policing, and extra transparency requirements for AI judged to be high-risk, such as systems used in border control.

FEATURED VIDEO

 

This is only the start of a long process. Once the members of the European Parliament (MEPs) vote on the agreement later this month, it will need to be negotiated all over again with EU member states. But Europe’s politicians are some of the first in the world to go through the grueling process of writing the rules of the road for AI. Their negotiations offer a glimpse of how politicians everywhere will have to find a balance between protecting their societies from AI’s risks while also trying to reap its rewards. What’s happening in Europe is being closely watched in other countries, as they wrestle with how to shape their own responses to increasingly sophisticated and prevalent AI.

“It’s going to have a spillover effect globally, just as we witnessed with the EU General Data Protection Regulation,” says Brandie Nonnecke, director of the CITRIS Policy Lab at the University of California, Berkeley.

At the core of the debate about regulating AI is the question of whether it's possible to limit the risks it presents to societies without stifling the growth of a technology that many politicians expect to be the engine of the future economy.",https://www.wired.com/story/the-global-battle-to-regulate-ai-is-just-beginning/,,,,,,,,
5/7/2023 9:00,The Best Sex Toys for Every Body,"SEX TECH HAS come a long way in the past 10 years—not only in terms of cultural acceptance and awareness, but also technology. Gone are the days of clunky, pink plastic rabbit vibrators and sex toys that feel like knockoff action figures. Today's toys are designed by sex educators, medical professionals, and some of the world’s greatest sexperts. They feature ultra-premium, surgical-grade silicone, robust Bluetooth connectivity, programmable vibration patterns, and multiple motors all designed to help you have a good time.

There’s never a bad time to invest in a little extra self-care. These are some of our favorite sex toys, vibrators, smart vibrators, personal wand massagers, and accessories, all of which we’ve personally tested. There’s something here for everyone, every gender, and every body. The language on these products isn’t always gender-inclusive, but we approached testing with a gender-inclusive mindset, testing these with a variety of different genitals, bodies, and partners.

Still don't see anything you like? Be sure to check out our other bedroom-related guides on the Best Sounds for Sleep, the Best Mattresses, and the Best Sound Machines.

Updated May 2023: We added the Satisfyer Pro 2 Gen 3 and updated links and prices.

Special offer for Gear readers: Get a 1-year subscription to WIRED for $5 ($25 off). This includes unlimited access to WIRED.com and our print magazine (if you'd like). Subscriptions help fund the work we do every day.",https://www.wired.com/gallery/best-sex-toys-and-tech/,,,,,,,,
5/7/2023 8:00,Your Twitter Feed Sucks Now. These Free Add-Ons Can Help,"I'M NOT HERE to judge anyone who pays for Twitter Blue. However, I'm not a fan of pay-to-win mechanics. At this point, Twitter is a game where players compete for the most attention; Twitter Blue is overpowered DLC. If you buy a subscription, your tweets are shown at the top of comment threads and prioritized in other contexts, including the “For You” page. This makes Blue the social media equivalent of paying for unlimited ammo or improved body armor, regardless of who you are or whether what you have to say is worth promoting.

It also makes Twitter really annoying to use. No one wants to play with the people who are paying to win. That's why there's so much mockery of, and desire to avoid, Twitter Blue users.

Granted, there are plenty of reasons why longtime Twitter power users—in particular, public figures or people who historically have trouble with impersonators—might pay for Twitter Blue. No one wants to lose an audience they worked hard to build, and Twitter has the right to monetize itself however it likes. You also have the right to consume (or not consume) the social media you choose.

FEATURED VIDEO

 

All the same, it can't be denied that a lot of really annoying posts from Twitter Blue users with low follower counts show up in all kinds of contexts. If you don't want to see those posts, I don't blame you, and here's how you can filter them all out:

Blue Lite Blocker
TWITTER VIA JUSTIN POT

BlueLiteBlocker is a free, open-source browser extension for Chrome and Firefox that can filter comments from Twitter Blue subscribers out of your Twitter timeline. You can install the extension and then use Twitter the way you normally do. All comments from Twitter Blue users will be obscured—you can click “View” if you are absolutely certain you want to see them.",https://www.wired.com/story/twitter-feed-add-blue-block/,,,,,,,,
5/7/2023 8:00,How to Choose the Right TV,"TVS CAN BE tricky to buy. Whether you read my exquisite guide to the Best TVs or not, you probably won't find every top model at your local Walmart, Best Buy, or Costco. And when you're browsing retail websites, it's easy to feel overwhelmed by marketing speak like HDR or “local dimming.” That's why I've collected a few tips, tricks, and terms to help you shop smarter when buying a new TV. Think of these as a checklist to consider before you head to the store (or Amazon) to buy your next big screen. 

Be sure to check out our guide to the best soundbars and our tips on upgrading your home audio to round out your home theater.

Table of Contents
What Size TV Should You Get?
What Screen Resolution Do You Need?
What Is Backlighting?
What's High Dynamic Range?
Gaming Performance
What About TV Software?
The Right Ports
How Much Should You Expect to Pay?
Get a Soundbar

Updated May 2023: We've updated this guide to reflect modern pricing and information about the TV market.

FEATURED VIDEO

 

Special offer for Gear readers: Get a 1-year subscription to WIRED for $5 ($25 off). This includes unlimited access to WIRED.com and our print magazine (if you'd like). Subscriptions help fund the work we do every day.

If you buy something using links in our stories, we may earn a commission. This helps support our journalism. Learn more.

What Size TV Should You Get?
TCL 6-Series PHOTOGRAPH: TCL

Bigger screens are always better, right? When it comes to TVs, sure, but that doesn't mean you should always spring for the largest size. Pricing on bigger models can get out of hand, and you should always make sure you have room for all that screen footage. 

Under 55 Inches

Some high-end OLED TVs have smaller sizes so they can double as computer monitors, but most TVs below 55 inches are largely nonstandard these days. Many manufacturers still make models below this size, but you likely won't be getting the latest and greatest performance.

55-Inch TVs

This is the smallest standard size for modern TVs. It’s ideal for the average room in a home or apartment, but if you have a larger space, you may want to size up. Be aware that TVs this size and larger often come with feet on both ends of the screen; if you’re not wall-mounting, make sure you measure the width of your TV stand to ensure it can hold your new TV.

65-Inch TVs

This is a good option for larger living rooms or for spaces where you’re going to have many eyes watching at once. If you have the extra cash and space, it is worth the upgrade for those who love seeing details even closer in films and TV shows. 

75 Inches and Above

I only recommend TVs this size and larger for people who have huge rooms and are looking for a truly cinematic experience. Buyer beware: Pricing on TVs this large can get exorbitant (into the tens of thousands for high-end models). Cheaper ones (under $1,000) might not look great due to limitations in processing and panel lighting. Be prepared to have a professional or a group of friends help you move and mount a screen this large.

What Screen Resolution Do You Need?
TCL 8K TV PHOTOGRAPH: TCL

Resolution means the number of pixels on your screen. Modern TVs come in 1080p “Full HD” resolution (1,920 x 1,080 pixels), 4K “UHD” (3,840 x 2,160), and 8K “8K UHD” (7,680 x 4,320) variants. The former and the latter are somewhat rare, but for opposite reasons: Full HD screens are now old tech and are reserved for only the smallest and cheapest offerings; 8K resolution is available mostly on expensive, very large TVs.",https://www.wired.com/story/how-to-buy-the-right-tv/,,,,,,,,
