date,title,articles,url,,,,,,,,
5/12/2023 10:00,The Best Air Fryers for Quick and Easy Cooking,"KEEP HEARING ABOUT the joys of air frying? Providing a faster and healthier way to cook fried foods with little to no oil, an air fryer has become something of a kitchen staple. It works much like a convection oven to circulate hot air around your food—only it’s more compact and increases your time savings. Think guilt-free crispy chicken, homemade fries, and donuts that are not only simple to make, but come with easier clean-up compared to using a traditional deep-fat fryer.

With smaller capacity interiors to heat and shorter preheating times, an air fryer can be a quicker way to cook than your standard oven too—potentially saving you money off your energy bills if used wisely. (Just make sure it’s large enough to cook what you need, otherwise you’ll be using it multiple times—which will defeat its energy-saving purpose.) Multifunctional in design, some air fryers come loaded with preset cooking modes for baking, roasting, dehydrating, grilling, and reheating. They can tackle a range of meat, fish, and vegetables effectively, as well as sweet treats: think steak and sweet potato fries, homemade apple crisps and a warm banana loaf. Here are WIRED's top picks to suit a range of ingredients and price points.

Check out more of WIRED's top kitchen tech and accessory guides, including the Best Electric Kettles, Best Latte and Cappuccino Machines, Best Chef's Knives, and the Best Gear for Small Kitchens.

Special offer for Gear readers: Get a 1-year subscription to WIRED for $5 ($25 off). This includes unlimited access to WIRED.com and our print magazine (if you'd like). Subscriptions help fund the work we do every day.",https://www.wired.com/gallery/best-air-fryers/,,,,,,,,
5/12/2023 9:00,You’re Probably Underestimating AI Chatbots,"IN THE SPRING of 2007, I was one of four journalists anointed by Steve Jobs to review the iPhone. This was probably the most anticipated product in the history of tech. What would it be like? Was it a turning point for devices? Looking back at my review today, I am relieved to say it’s not an embarrassment: I recognized the device’s generational significance. But for all the praise I bestowed upon the iPhone, I failed to anticipate its mind-blowing secondary effects, such as the volcanic melding of hardware, operating system, and apps, or its hypnotic effect on our attention. (I did urge Apple to “encourage outside developers to create new uses” for the device.) Nor did I suggest we should expect the rise of services like Uber or TikTok or make any prediction that family dinners would turn into communal display-centric trances. Of course, my primary job was to help people decide whether to spend $500, which was super expensive for a phone back then, to buy the damn thing. But reading the review now, one might wonder why I spent time griping about AT&T’s network or the web browser’s inability to handle Flash content. That’s like quibbling over what sandals to wear just as a three-story tsunami is about to break.

This is an edition of Steven Levy's Plaintext newsletter.

SIGN UP for Plaintext and tap into Steven Levy's unmatched insights for the long view on tech.

I am reminded of my failure of foresight when reading about the experiences people are having with recent AI apps, like large language model chatbots and AI image generators. Quite rightfully, people are obsessing about the impact of a sudden cavalcade of shockingly capable AI systems, though scientists often note that these seemingly rapid breakthroughs have been decades in the making. But as when I first pawed the iPhone in 2007, we risk failing to anticipate the potential trajectories of our AI-infused future by focusing too much on the current versions of products like Microsoft’s Bing chat, OpenAI’s ChatGPT, Anthropic’s Claude, and Google’s Bard.

This fallacy can be clearly observed in what has become a new and popular media genre, best described as prompt-and-pronounce. The modus operandi is to attempt some task formerly limited to humans and then, often disregarding the caveats provided by the inventors, take it to an extreme. The great sports journalist Red Smith once said that writing a column is easy—you just open a vein and bleed. But would-be pundits now promote a bloodless version: You just open a browser and prompt. (Note: this newsletter was produced the old-fashioned way, by opening a vein.)

FEATURED VIDEO

 

Typically, prompt-and-pronounce columns involve sitting down with one of these way-early systems and seeing how well it replaces something previously limited to the realm of the human. In a typical example, a New York Times reporter used ChatGPT to answer all her work communications for an entire week. The Wall Street Journal’s product reviewer decided to clone her voice (hey, we did that first!) and appearance using AI to see if her algorithmic doppelgängers could trick people into mistaking the fake for the real thing. There are dozens of similar examples.

Generally, those who stage such stunts come to two conclusions: These models are amazing, but they fall miserably short of what humans do best. The emails fail to pick up workplace nuances. The clones have one foot dragging in the uncanny valley. Most damningly, these text generators make things up when asked for factual information, a phenomenon known as “hallucinations”' that is the current bane of AI. And it’s a plain fact that the output of today’s models often have a soulless quality. 

In one sense, it’s scary—will our future world be run by flawed “mind children,” as roboticist Hans Moravec calls our digital successors? But in another sense, the shortcomings are comforting. Sure, AIs can now perform a lot of low-level tasks and are unparalleled at suggesting plausible-looking Disneyland trips and gluten-free dinner party menus, but—the thinking goes—the bots will always need us to make corrections and jazz up the prose.",https://www.wired.com/story/plaintext-youre-probably-underestimating-ai-chatbots/,,,,,,,,
,What Do a Falling Apple and an Orbiting Moon Have in Common?,"IF YOU DROP an object, it will fall. It's a motion that we’ve all seen hundreds of times. We’ve also all seen plenty of the moon, which makes one complete orbit around our planet every 27.3 days (as seen from the Earth). Falling and orbiting may seem like radically different types of motion, but they’re not! The same physics explains them both.

There is a famous story about Isaac Newton making the connection thanks to a falling apple. (It's probably not true—but it might be.) Still, his realization is kind of amazing, so I'm going to walk you through the whole process. It includes some concepts that people living today might take for granted, but the building of knowledge like this isn't trivial, and Newton didn't figure everything out on his own. He built on ideas from Galileo, who studied the motion of falling objects, Robert Hooke, who explored the effects of things moving in circles, and Johannes Kepler, who produced ideas about the motions of the planets and moon.

Falling Objects

Let’s start with what happens to an object as it falls. In the third century BC, Aristotle asserted that a massive object will fall faster than a low-mass one. Sounds reasonable, right? That seems to fit with what we see—imagine dropping a rock and a feather at the same time. But Aristotle wasn't big on testing his theories with experiments. It just seemed to make sense that a heavier object falls faster. Like most of his philosopher peers, he preferred to come to conclusions based on armchair logic.

FEATURED VIDEO

 

Aristotle also reasoned that objects fall at a constant speed, meaning they don’t slow down or speed up as they go. He probably arrived at this conclusion because dropped objects fall quickly, and it’s really hard to spot changes in speed with the naked eye.

But much later, Galileo Galilei (who went by his first name because he thought that was cool) came up with a way to slow things down. His solution was to roll a ball down a ramp instead of dropping it. Rolling the ball at a very slight angle makes it much easier to tell what's going on. It might look something like this:

VIDEO: RHETT ALLIN

Now we can see that as the ball rolls down the track, it increases in speed. Galileo suggested that during the first second of motion, the ball will increase in speed a certain amount. It will also increase by the same amount of speed in the next second of motion. That means that during the time interval between 1 and 2 seconds, the ball will travel a farther distance than it did in the first second.

He then suggested that the same thing happens as you increase the steepness of the angle, as it would produce a greater increase in speed. That must mean that an object on a completely vertical ramp (which would be the same as a falling object) would also increase in speed. Boom—Aristotle was wrong! Falling objects don't fall at a constant speed, but instead change speed. The rate at which the speed changes is called acceleration. On the surface of the Earth, a dropped object will accelerate downward at 9.8 meters per second per second.

We can write the acceleration mathematically as a change in velocity divided by the change in time (where the Greek symbol Δ indicates a change).",https://www.wired.com/story/what-do-a-falling-apple-and-an-orbiting-moon-have-in-common/,,,,,,,,
5/12/2023 9:00,Elvis Director Baz Luhrmann Doesn't Think AI Will Conquer Movies,"THE MONITOR IS a weekly column devoted to everything happening in the WIRED world of culture, from movies to memes, TV to Twitter.

Baz Luhrmann blends in well here. The Australian writer, director, and producer is known for his flashy, hyper-realistic style, and on this particular New York night he’s in a sparse, brightly lit former taxi warehouse in Chelsea, talking to a robot. The bot’s name is Ai-Da; she’s a painter powered by artificial intelligence. (Yes, she identifies as female.) Before Luhrmann took the stage next to her, she was doing a watercolor while people gawked and took photos. “Did you see Elvis, Ai-Da?” he asked. She paused for an almost awkward period before replying. Her favorite Luhrmann film is Romeo + Juliet.

THE MONITOR
AI, the WGA Strike, and What Luddites Got Right

ANGELA WATERCUTTER

FAKE FANS
Spotify Has an AI Music Problem—but Bots Love It

AMANDA HOOVER

ARTIFICIAL INTELLIGENCE
Death of an Author Prophesies the Future of AI Novels

TOM COMITTA

The director was unfazed. “I am not fearful of AI,” Luhrmann told me prior to the presentation, which he gave as part of the opening of a new art installation called Saw This, Made This. Then he backpedaled a bit, clarifying that he’s not fearful of AI taking his job as a director. “I spoke to Ai-Da this morning and said, ‘Should we be concerned about AI destroying the world?’ and she said, ‘Absolutely.’” Ultimately, Luhrmann says, AI is a new technology, and how it will be used—for creative purposes or nefarious ones—depends on humans. 

FEATURED VIDEO

 

Pretty much every writer, director, musician, and painter is facing the AI question right now. Many answers echo Luhrmann’s. It depends on their interactions with the technology. Members of the Writers Guild of America, who are currently on strike, are concerned that studios may one day soon want AI to write scripts that human writers then fix for a lower fee. Frank Ocean fans are reportedly getting scammed into paying for machine-generated songs. Visual artists claim AI models are unfairly being trained on their work. This week, author Stephen Marche released a novella he wrote with considerable help from large language model (LLM) tools ChatGPT, Sudowrite, and Cohere. 

The outcome of these conflicts over AI use in pop culture will have ramifications for decades to come. That’s why the arguments are so heated. Tech has been evolving and, forgive me, disrupting things for long enough now that people know the signs. Without some shared laws, beliefs, and ethics to govern the ways AI can be used, it could run rampant. Without the guidelines currently employed by the US Copyright Office stipulating that copyrightable works must have human authorship, without rules about what jobs AI can do, chaos reigns. 

Ironically, chaos is what Luhrmann notes that humans can handle and AI can’t. “Artists, to a person, are generally self-medicating flaws and chaos within them,” he says. “The thing AI just doesn’t have at the center of it is random chaos. Emotion.” I note the sign seen on the WGA picket line that said “ChatGPT doesn’t have childhood trauma.” The director agrees. “There’s understandable fear,” he says, “because when you get this massive change, there’s going to be things caught in the crossfire.” 

That doesn’t mean he thinks AI can replace human creativity, at least not presently. Which brings us back to Elvis Presley. There are people who change their appearance, their bodies, their mannerisms in order to perform as the King of Rock ’n Roll. They’re called impersonators. In his Elvis movie, Luhrmann says, “Austin Butler did not do an impersonation. What he did was Austin Butler’s interpretation of the soul of Elvis Presley. An AI can impersonate, it can’t interpret.” As we’re parting, I ask him what he’d like to do, as a filmmaker, with AI. Turns out he has already incorporated it into his work—it was the tech he used to fade Butler’s face into Presley’s. ",https://www.wired.com/story/baz-luhrmann-interview-artificial-intelligence-hollywood/,,,,,,,,
5/12/2023 9:00,BlackBerry Is a Movie That Portrays Tech Dreams Honestly—Finally,"IT’S QUAINT, LOOKING back on it now, but in the decade before iPhones, Androids, and Samsung Galaxies, BlackBerry was the smartphone. It was dubbed the “CrackBerry,” because of the seemingly addictive hold the sleek gizmo, with its satisfyingly clicky keyboard buttons, had on the market. Kim Kardashian was glued to hers. Barack Obama ran the free world from his. And its famously secure messaging client helped international drug rings conduct businesses across the globe.

RIP
The End of BlackBerry Phones Is Finally, Truly Here

JOHN TIMMER, ARS TECHNICA

RIP
The End of the BlackBerry Is Officially Upon Us 

RON AMADEO, ARS TECHNICA

MOVIES
How Do You Make the Fake NASA Documentary Operation Avalanche? Hire a Really Good Lawyer

ANGELA WATERCUTTER

Now, it’s a relic. An also-ran. Or, as one character puts it in BlackBerry, a new movie about the early smartphone empire’s rise and fall, it’s merely “the thing people used before they used the iPhone.” But as this fresh, thoughtful comedy makes plain, BlackBerry is more than just a bleak cautionary tale. It’s a story of how tech culture, as we know it today, took root, bloomed, and died on the vine.

The movie opens with a telling title card: “The following fictionalization is inspired by real people and real events that took place in Waterloo, Ontario.” Matt Johnson, the film’s director and cowriter, shrugs it off as “a prefix designed by our lawyers.” But beyond ensuring artistic license, it also situates the film, squarely, in a sleepy town about an hour and half from Toronto. 

FEATURED VIDEO

 

Before the super successful BlackBerry and its parent company, Research in Motion, revamped the region as an aspiring tech hub, Waterloo and its environs were better known for their lively farmer’s market culture and Mennonites in horse-drawn buggies.

What BlackBerry captures is the period that disrupted that, a short-lived rumpsringa in the late '90s and early aughts when the future of tech and telecommunications felt truly global. It was a period when anywhere could be the next Silicon Valley. In this sense, the titular gadget—which promised palm-of-your-hand connectivity across the globe—is, quite literally, a structuring device.

LOOSELY BASED ON the 2016 book Losing the Signal, BlackBerry seems at first blush like a familiar, Social Network-style drama of a company’s explosive rise. Nebbish engineer Mike Lazaridis (This Is the End’s Jay Baruchel) teams up with Jim Balsillie (It’s Always Sunny in Philadelphia’s Glenn Howerton), a menacing Harvard MBA. It’s a marriage of mutual convenience, undergirded by a more Faustian logic.

With Lazaridis’ ability to exploit existing wireless infrastructure, and Balsillie’s command of boardroom politics, the pair invent, and cannily market, the modern smartphone. In one funny montage, Howerton’s Balsillie recasts his sales force (“Dead-eyed dumb fucks,” as he calls them) as actors, dispatching them to fancy restaurants and private clubs to talk loudly on their BlackBerrys, in an effort to call attention to the device. “It’s not a cell phone,” he insists. “It’s a status symbol.” 

Where Balsillie is eager to exploit the device’s appeal to a class of go-go C-suite dicks—and backdate employment contracts, and play cat-and-mouse with the SEC, and generally overpromise and underdeliver—Lazaridis is more preoccupied with the nuts-and-bolts of obsessively engineering a worthwhile product. His motto: “‘Good enough’ is the enemy of humanity.” For Baruchel (who, with great reluctance, relinquished his own vintage BlackBerry just two years ago), the film is a parable, warning about what happens “when you get so big that you’re beholden to other masters.” 

“It’s no coincidence that the guys who invented the first tele-communicator were all Star Trek fanatics.”

FILMMAKER MATT JOHNSON

If Balsillie (“Ballsley, not Ball-silly,” he seethes) is the corporate devil on Lazaridis’ shoulder, the better, or at least geekier, angels of his nature are represented by longtime friend and cofounder, Doug Fregin. As imagined (and played by) Johnson, Doug is a hyperactive goober in wide, windshield eyeglasses and a David Foster Wallace headband. He compares Wi-Fi signals to the Force in Star Wars, pays for business lunches with cash pried out of a velcro Teenage Mutant Ninja Turtles wallet, and uses “Glengarry Glen Ross” as a verb.

For Johnson, pop culture is a kind of lingua franca. His cult web series turned Viceland sitcom Nirvanna the Band the Show, is riven with references and extended homages: to the Criterion Collection, Nintendo’s Wii Shop Wednesday, the rollerblading sequence set to a Prodigy track in the 1995 film Hackers. But more than a pop encyclopedia, Johnson is also a deft prober of the nerd pathology. In his feature debut, 2013’s The Dirties, he plays an alienated high schooler avenging himself on his bullies by plotting a school shooting, under the auspice of making a student film about a school shooting. “School shooting comedy” is a tough sell. But Johnson committed to the premise with verve, humor, and considerable intelligence, revealing how certain dorky defense mechanisms (from pop culture obsessiveness to irony) can curdle into out-and-out psychopathy. ",https://www.wired.com/story/blackberry-movie-review/,,,,,,,,
5/12/2023 8:00,Which Google Pixel Phone Should You Buy?,"GOOGLE'S PIXEL PHONES are our favorite Android phones here at WIRED, and they have been for a few years. They have industry-leading cameras, get speedy software and security updates directly from Google (like iPhones do from Apple), and are priced competitively. But choosing the right model can be tricky. Should you get the Pixel 7A? Or save your money and stick with the older Pixel 6A? Or buy the crazy-expensive Pixel Fold? 

Don’t fret—we’re going to break down the differences between the best Pixel phones and sort out the right one for you. We also have Pixel-exclusive tips to help you get the most out of your new phone, and we recommend some cases and accessories we’ve tested if you want protection.

Updated May 2023: We’ve added the Pixel 7A, mentioned the Pixel Fold, and added a Totallee case.

Table of Contents
The Best Pixel for Most People: Pixel 7A
The Best Budget Pixel: Pixel 6A
Upgrade Pick: Pixel 7 Pro
About the Pixel Fold
Is Pixel Pass Worth It?
About Those Older Pixel Phones
Cases and Accessories We Like
Hidden Tricks to Try If You Get a Pixel
About That Google Photos Storage
Built-In VPN by Google One

Special offer for Gear readers: Get a 1-year subscription to WIRED for $5 ($25 off). This includes unlimited access to WIRED.com and our print magazine (if you'd like). Subscriptions help fund the work we do every day.

If you buy something using links in our stories, we may earn a commission. This helps support our journalism. Learn more.

The Best Pixel for Most People

PHOTOGRAPH: GOOGLE

Google Pixel 7A
$499 AT AMAZON
$499 AT TARGET
$499 AT BEST BUY

The Pixel 7A (8/10, WIRED Recommends) sets a new standard for mid-range smartphones. It's a little pricier than last year's Pixel 6A but packed with nearly every top-end feature you could want. This iteration includes wireless charging, which is really uncommon for phones under $500. You also get a 90-Hz screen refresh rate, which makes the onscreen interactions look and feel more fluid as there are more frames per second than before. 

FEATURED VIDEO

 

Its design and build quality are similar to its predecessor, though Google claims the aluminum mid-frame is slightly more durable. There's still Gorilla Glass 3 on the front screen, which isn't as scratch-resistant as some of the glass on pricier Pixels, but at least the rear is a plastic composite that feels luxe and won't crack. This model comes in Charcoal, Sea, and Snow, but there's a Google Store–exclusive Coral that has my eye.  

You won't run into any problems with performance. It's powered by Google's Tensor G2 chipset, which is the same one that's inside the Pixel 7 Pro. It's plenty fast for everyday tasks and most mobile gaming, and it also allows for a few new software tricks, like Photo Unblur, which can use machine learning algorithms to unblur people's faces in those late-night pics. (It actually did this really well when I tried to capture a photo of a bride and groom on the dance floor!)",https://www.wired.com/story/best-google-pixel-phone/,,,,,,,,
5/12/2023 8:00,Google Is Opening the AI Floodgates,"GOOGLE WOULD LIKE you to know that it has been at the forefront of machine intelligence for decades, actually. Never mind that it was beaten to the generative AI hype party by the likes of OpenAI and Microsoft Bing, because Google has big plans. At its I/O developer conference this week, in addition to announcing some new hardware (including a folding phone), Google turned on the firehose of AI. During a two-hour presentation, the company showed how it’s busily building generative technologies into nearly everything it does. Chatbots, text generators, and content creation tools will soon be embedded in Google’s devices, search pages, Android apps, and Google's Workspace suite of productivity apps like Gmail, Docs, and Sheets.

This week on Gadget Lab, we talk about the big news from Google’s I/O event and why the company is so dead set on sticking AI in absolutely everything.

Show Notes

Read all of WIRED’s coverage from Google I/O, including everything the company announced, how Google is adding AI to search and Android, and the details of the new Pixel Fold (and why Google might not really care if you buy it.)

Recommendations

Julian recommends going on vacation and also the new Legend of Zelda game. Lauren recommends Janet Malcom’s book Still Pictures. Mike recommends the JBL Reflect Aero earbuds.

FEATURED VIDEO

 

Julian Chokkattu can be found on Twitter @JulianChokkattu. Lauren Goode is @LaurenGoode. Michael Calore is @snackfight. Bling the main hotline at @GadgetLab. The show is produced by Boone Ashworth (@booneashworth). Our theme music is by Solar Keys.

Sign Up Today

Sign up for our Podcasts newsletter to catch all our latest audio offerings, including the Gadget Lab podcast and our huge library of narrated articles.
How to Listen

You can always listen to this week's podcast through the audio player on this page, but if you want to subscribe for free to get every episode, here's how:

If you're on an iPhone or iPad, open the app called Podcasts, or just tap this link. You can also download an app like Overcast or Pocket Casts, and search for Gadget Lab. If you use Android, you can find us in the Google Podcasts app just by tapping here. We’re on Spotify too. And in case you really need it, here's the RSS feed.",https://www.wired.com/story/gadget-lab-podcast-597/,,,,,,,,
