date,title,articles,url,,,,,,,,
5/10/2023 16:45,Everything Google Announced at I/O 2023,"THE OPENING KEYNOTE address of the Google I/O developer conference today was stuffed with announcements of new devices and AI-powered features coming to familiar software tools. The company leaned hard into generative computing, loudly characterizing itself as a decades-long leader in AI tech. It also gleefully put AI at the forefront of nearly every service and device it operates, including the new Pixel phones and tablet it unveiled today.

Here are all of Google’s announcements from I/O 2023.

PHOTOGRAPH: JULIAN CHOKKATTU
The Pixel Fold Arrives
Google hardware chief Rick Osterloh announces the Pixel Fold on stage. PHOTOGRAPH: JUSTIN SULLIVAN/GETTY IMAGES

Google’s first folding phone, the Pixel Fold, is here and costs a startling $1,799. It’s thinner than Samsung’s Galaxy Z Fold4, and there’s a wide, full front screen that offers up an almost normal smartphone experience. Open it up and you get a 7.6-inch OLED screen for watching movies, multitasking, or reading. We’ve got a hands-on report where you can read more about the Fold. Preorders are live now—if you bite, Google is tossing in a free Pixel Watch—but it ships in June. 

There’s a Pixel Tablet Too
The Pixel Tablet comes with a speaker dock that it magnetically attaches to. PHOTOGRAPH: GOOGLE

Announced at last year’s Google I/O, the Pixel Tablet is finally a reality. Well, almost—preorders are live today (only in 11 countries), and it goes on sale June 20, so you still have to wait a bit more. This $499 tablet isn’t really meant to be a tablet you take with you on the go. Rather, it rests on a magnetic dock (included) when you’re not using it, and the dock wirelessly recharges the slate and doubles as a speaker (the sound quality is purportedly equal to a Nest Hub). When it’s on the dock, it acts as a traditional Google smart speaker, with options to control your smart home devices, and even has a similar microphone array to pick up your “Hey Google” commands. Chromecast is built in, so you can cast to it from your phone or laptop. 

FEATURED VIDEO

 

When you want to use it, just pop it off the dock and it’s a normal Android tablet—except a bit better, because Google has made some strides in improving the tablet experience on Android, with more than 50 Google apps optimized for the larger screen. It’s powered by the Tensor G2 chipset, and has many of the same software features as other Pixel devices. Sadly, there are no other accessories—no stylus and no keyboard. You can take it out and use it with Bluetooth accessories, but it’s clear Google is really envisioning this as a homebody.

Also a Low-Cost Pixel 7A

Every year, Google announces an A-series version of the flagship Pixel that came before. This year’s Pixel 7A is a little more pricey ($499) than last year’s model, but you get a few more high-end perks, like a 90-Hz screen refresh rate and wireless charging support. The cameras are also completely new, with a 64-megapixel sensor leading the pack. You can read more about it in our review (8/10, WIRED Recommends). You can also order it right now—Google is tossing a free case and $100 for another accessory (like the Pixel Buds A-Series) if you buy it today.

Chatbot-Style Answers Are Coming to Search
VIDEO: GOOGLE

Google users in the US will be able to access an experimental version of the company’s web search that incorporates ChatGPT-style text generation. For some queries, AI-generated text will appear above the usual links and ads, summarizing information drawn from across the web. A query about the coronation of Britain’s new king might be met with a couple of paragraphs summarizing the event. If asked about ebikes, Google’s algorithms can list bullet-point takeaways of product reviews published by various websites. WIRED, of course, is one of those websites that publish many product reviews, so we’ll be watching to see how this feature changes the way readers encounter our buying advice.

Android Gets an AI Boost
VIDEO: GOOGLE

Google’s updates to Android—normally the focus of I/O events in the past—came some 80 minutes into the event. As you might have guessed, Google is sticking even more AI features into its mobile operating system. It laid out some enhancements to privacy protection, but mostly focused on cosmetic settings. The big setting that Google execs seemed stoked about involved AI wallpapers, which let you change the art styles of photos and create interactive, moving backgrounds from pictures and emoji.

Google is also bringing the generative features of its Bard chatbot directly into Android messaging, with settings that let you ask questions right in the chat box and adjust the syntax of your messages to adapt to different tones.

Generative AI Creation Tools in Workspace

Google is sliding AI into its Workspace apps like Google Docs, Sheets, and Slides. Duet AI for Workspace, as it’s called, can use Google’s generative AI to create job descriptions, write creative stories, or auto-generate spreadsheets for tracking information. It can also build out whole presentations, suggesting text for slides or instantly generating custom visual elements like photos. It appears to be Google’s answer to Microsoft’s 365 Copilot, which uses some of the company’s generative tools to add productive and creative enhancements to Microsoft’s Office software. Google’s AI-powered updates to its free web-based software suite will be available to consumers soon, the company says.

Behold the Magic Editor

An update to Google’s photo-editing feature Magic Eraser is coming later this year. The tool will now be called Magic Editor, and Google says it’s basically a quick mobile version of Photoshop. Users can change nearly every element of a photo, including adjusting lighting, removing unwanted foreground elements like backpack straps, and even moving the subject of the photo into other parts of the frame.

Google’s pitching the service as a way to enhance photos, but the potential is there to make really any edit to a photo at all. It’s not hard to imagine this going wildly off the rails, as any photo can be easily adjusted to move people around, reposition arms so it appears the person was touching something they weren’t, or even add elements to the frame that weren’t there in real life. Google hasn’t said whether the manipulated photographs will be labeled as such, though it did mention it would be watermarking images that were entirely generated by computers.

Matter and Smart Home

We always seem to be on the cusp of the real and helpful—and not annoying—smart home. But what will it take to tip that expectation over the edge into reality? Google bets that small, incremental improvements will slowly tempt you to incorporate more connected devices into your home, like the fabric-covered Pixel tablet that functions as a portable Nest hub with one-tap access to a newly redesigned Google Home app. Other sweeteners include easier access to Google Home from your Wear OS smartwatch and a new control panel for your home that runs on Android tablets. Google is even—gulp—building tools to provide Matter support for iOS users.

Google didn’t spend a lot of time touting the relatively new Matter smart home standard during the I/O keynote. But it did let us know in briefings that in just a few weeks, you’ll be able to control Matter devices in the Google Home app from iOS devices. Any family member can access the panel, or switch profiles. As they say, if you can’t beat ’em, join ’em … in putting a Matter sticker on every home appliance.

Android Auto

In something of a plodding reply to Apple’s startling plans for CarPlay 2 announced in June last year, Google’s Android Auto team finally has news to share. It didn’t come during the I/O keynote, but it came in side-briefings before the show.

Cottoning on to the fact that people are sitting in their vehicles with little to do while at charging stations, Android Auto will soon support video, gaming, and browsing in cars. Apparently, YouTube will be available in Polestars, which already run on a Google OS, in the coming weeks. Games mentioned include Beach Buggy Racing 2 (will you be able to play using the steering wheel?), and Solitaire FRVR (yawn). Apple’s version, rather than working alongside the existing car software, will supposedly replace it entirely—so this Android automotive update feels “lite” in comparison. Still, car companies will likely be happier with Google’s less aggressive approach here. Android Auto is also working with Cisco, Microsoft, and Zoom to enable conference calls, so you can join meetings by audio directly from the car display. Gaming, browsing the web, and conference calls ... this is hardly bleeding-edge tech. It’s also worth noting that if you’re sitting and charging your EV, you can do all this from your phone anyway. But any improvement to the in-car Android experience is welcome.",https://www.wired.com/story/google-io-2023-everything-announced/,,,,,,,,
5/10/2023 16:00,Google Is Racing to Bring More AI to Android ,"IN THE DAYS leading up to its annual software conference, Google executives were unusually excited about … wallpaper. Phone wallpaper. Wallpaper that changes and breathes and undulates on Android phones, specifically. Wallpaper that’s generated by artificial intelligence after tapping a few prompts on your phone screen. 

“Generative AI” is the key phrase here. It’s the category of artificial intelligence that tech companies both big and small are hanging their futures on right now. Alphabet-owned Google is one of the pioneers in this space; as Google executives like to remind people, the “T” in OpenAI’s ChatGPT actually refers to transformer technology that Google introduced back in 2017. And Google has been working on humanlike chatbot technology for years. 

But now Google is largely perceived as being behind in generative AI, since both OpenAI and Microsoft (which funds OpenAI) released their GenAI chat tools before Google had a chance to unleash its own tool, called Bard. The release of ChatGPT even reportedly triggered a “code red” for Google, leading the company to funnel more resources into building AI products, and yesterday. 

FEATURED VIDEO

 

So it makes sense that Google would use I/O, its annual developer conference that kicked off today in Mountain View, California, as a stage to tout its latest AI features. AI is the thread woven throughout the program. It’s also featuring prominently in two new Android-specific features, demonstrating just how eager Google is to unleash usable products around generative AI and get into the hands of potentially billions of people. 

“We’re in this position where Google has pioneered much of the seminal research, particularly around this class of large language models, which is the basis of this nonlinear step forward in tech,” Dave Burke, vice president of engineering for Android, said in an interview with WIRED. “And at the same time we have these large surfaces of Android. And we can bring the two things together.” 

“For Google, the Android ecosystem offers a platform to prove its innovative AI portfolio at a scale that not all of their cloud peers can compete with,” says Chirag Dekate, vice president and analyst at Gartner.

Picture This

The new suite of generative wallpapers for Android seem basic but use varying levels of AI. There’s a customizable emoji option and a “cinematic” mode that turns still photos into mini movies. The latter uses on-device machine learning to determine what’s foreground in the image and what’s background, then creates a subtly zooming parallax effect. Generative AI wallpaper is more, well, generative: The user will tap on a series of predetermined prompts offered on the phone, like “classic arts,” “City by the bay,” and “Post-Impressionist,” which then generates entirely new and original wallpapers. 

VIDEO: GOOGLE
VIDEO: GOOGLE

Google says its image-generation model is trained on public domain artwork, which means it’s likely hoping to head off any sticky ethical issues around the AI art copyright. It also won’t be available to the masses right away: The wallpapers will roll out only to Google’s own Pixel phones first, starting next month. 

So … wallpaper? Google’s seminal research has resulted in AI Van Gogh on your phone? Well, yes, but Burke insists that while “it might seem obvious or simple in retrospect, this is one of the ways we’re thinking that AI can be applied in a very user-centric, responsible way.”",https://www.wired.com/story/generative-ai-features-coming-to-android/,,,,,,,,
5/10/2023 15:04,"Google’s Pixel Fold Is Finally Here, but It’s Not Cheap","SMARTPHONE SALES HAVE been declining lately, mostly because the smartphones themselves have not been changing drastically year over year. A slightly better camera here, a nicer screen there—the technology has plateaued. The solution, according to tech companies? Folding smartphones that cost $1,799. That's what the Pixel Fold is. 

Google isn't first to the folding phone party—Samsung is well past its fourth iteration already—but the company knows that while smartphone sales may be down, smartphone usage is going up. (It also helps that foldable smartphone sales are going up too.) Brian Rakowski, vice president of product management for Pixel at Google, says he believes there's “tremendous value” in a product like the Pixel Fold, as it opens up many more uses than a traditional single-screen smartphone. 

The company teased the Pixel Fold last week on its social channels, but it officially took the wraps off during the Google I/O 2023 keynote. The Fold isn't available just yet, though preorders are now live, with the promise the Fold will ship in June. Google is also tossing in a free Pixel Watch with every purchase. Here's everything you need to know about the Pixel Fold. 

If you buy something using links in our stories, we may earn a commission. This helps support our journalism. Learn more.

Enter the Fold
It folds book style instead of clamshell style. PHOTOGRAPH: JULIAN CHOKKATTU

I had a very brief time with the Pixel Fold, but if you've ever tried a Pixel 6 Pro or Pixel 7 Pro, it feels exactly like that but … it also folds. The Google hardware design ethos carries through, firmly cementing this phone as a Pixel, though I wish there was a snazzy color option (it only comes in Obsidian and Porcelain). Most impressive is the thinness, which Rakowski says was a priority for the team. At just 0.5 inches in its folded state and 0.2 inches when unfolded, it's just slightly thinner than the Samsung Galaxy Z Fold4 (though slightly heavier). 

FEATURED VIDEO

 

Is it drastically more pocketable or manageable than Samsung's foldable? I don't think so, but I'll need more time with the phone to say for sure. It still looks big and awkward when you see it next to a traditional smartphone. It likely won't fit in some pockets.

The 5.8-inch OLED screen on the front of the folded phone (which has a fast 120-Hz screen refresh rate) is decently wide and feels quite similar to a normal smartphone, if a little compact, when you're using it. Open the Fold up and you're treated to a 7.6-inch OLED panel with a 2K resolution (also with a 120-Hz screen). And yes, when you open an app on the front screen and unfold the Pixel Fold, it'll launch immediately with no delay on the larger inside screen. 

The outer screen and the glass covering the rear of the phone are Gorilla Glass Victus, which should offer some decent durability, but the inner screen is made of ultra-thin glass with a plastic layer. The stainless steel hinge that holds it all together offers up to 180 degrees of movement. (Google says it has tested it by folding it more than 200,000 times with no issues.) You can position the hinge in a variety of different angles, and thanks to the flat sides, the Pixel Fold can stay upright by itself. This enables a few tricks, like propping the phone up to take a photo with the primary camera on the rear, while using the front screen as a viewfinder. No tripod needed!",https://www.wired.com/story/google-pixel-fold-hands-on-news-specs-features-release-date/,,,,,,,,
5/10/2023 14:52,Google’s Pixel 7A Raises the Bar for Sub-$500 Phones,"THE PAST WEEK has been one of the busiest I've ever had. I flew to Dallas, Texas, for a friend's wedding, drove to Austin to visit an in-law, drove back for the wedding festivities, then flew back to New York, only to head out to San Francisco the next day for Google I/O 2023. The good news is that the new Google Pixel 7A has been in my pocket all the while, through every leg and layover, and it's never felt limited in any deal-breaking way. This is a $499 phone, and it's just more evidence that you really don't need to spend much more than that to get a good experience these days.

Is it the perfect phone? No. There are features missing here that some folks would want. Also, battery life is just OK, and the price has been hiked up $50 from last year's model. To remedy this, Google is continuing to sell last year's Pixel 6A at a lower price—$349—though you can routinely find it for sale at $299. That phone is still a good buy at either of those prices, but should you feel the need to spend a bit more, the Pixel 7A has just about everything you'd need.

The New Standard

The Pixel 7A mimics the design of the Pixel 7 and Pixel 6 series that came before. It's clean and unique, and it's easy to spot in a sea of iPhones and Samsungs—good if you want to feel different. It comes in Charcoal (black), Sea (baby blue), Snow (white), and Coral (orangey pink), the latter of which is exclusive to the Google Store. The blue is a little too faint for me—it often looks white—but the Coral is drop-dead gorgeous. I love a flashy phone.

The phone's frame is made of recycled aluminum, and the back is a plastic composite that by no means feels cheap. (It's also one less spot for cracked glass in case you drop the phone!) The front is made with Gorilla Glass 3, a product which is several years old at this point and isn't as scratch- and crack-resistant as modern formulations from Corning, the company that creates the hardened glass. Using older Gorilla Glass is one of the easy ways to bring down the price of a handset. Safe to say, even if the back can't crack as easily, it's worth getting a case. This Pixel is IP67-rated for water and dust resistance though, so a drop in the pool won't destroy it.

PHOTOGRAPH: JULIAN CHOKKATTU

The 6.1-inch OLED screen hasn't shown any weaknesses, even when I stared at it while walking in full sun (not to mention 94-degree heat paired with disgusting levels of humidity) in Austin. Is it as bright as the Samsung Galaxy A54 5G, the Pixel's closest competitor? No, but I rarely had to squint to read the display. You're treated to a 90-Hz refresh rate as well, which means everything from playing games to scrolling Instagram feels more fluid, as the screen is outputting more frames per second than traditional 60-Hz screens. It's a nice perk.

Performance is not an issue either. The Pixel 7A packs Google's Tensor G2 chipset with 8 gigabytes of RAM, the very same stack that powers its flagship Pixel 7 and Pixel 7 Pro. I've never seen the 7A stutter in my time with the phone. This chipset means you get access to many of the same G2-specific software features that debuted on the Pixel 7 series, such as Long Exposure in the camera app and Photo Unblur, which did effectively unblur some faces in my photos of the dance floor at the wedding.

The Pixel 7A is one of the few sub-$500 phones to feature wireless charging, and it's about damn time this started showing up in cheaper phones. It's so much nicer to plop your phone on a stand instead of hunting for a cable. That said, the 7A does skip some other niceties you might have liked to see, like a headphone jack, a microSD card slot, and a wall charger in the box (though you do get a USB-C to USB-C cable). The phone is also limited to 128 GB of internal storage; it'd be nice if Google took a page from Motorola and started offering 256 gigs.

Google has long had a lackluster in-display fingerprint sensor, and unfortunately the Pixel 7A follows that same path. On my first day of use, I had to put my thumb on the sensor a few times for it to unlock. It got drastically better over time, but I still needed to be more conscious and deliberate about finger placement than I was on other phones such as the aforementioned A54. It's just not a great sensor.",https://www.wired.com/review/google-pixel-7a/,,,,,,,,
5/10/2023 14:00,The Weird Way Australia’s Bushfires Influenced a Weirder La Niña,"THE COLOSSAL BUSHFIRES that tore through Australia in 2019 and 2020 charred some 37,500 square miles, obliterating iconic ecosystems and pushing already-threatened species to the brink. The blazes were so big they spawned their own towering thunderclouds.

Thousands of miles away, clear across the Pacific Ocean, the bushfires were affecting something more subtle yet very consequential: New modeling shows that the smoke helped cool the waters off South America, greatly increasing the chances of the rare three-year La Niña that ensued. That’s the band of chilled water in the Pacific that lasted from late 2020 to early 2023. La Niña influences weather around the world, so the bushfires ended up having a widespread effect, long after the last embers stopped glowing in Australia. 

“It skewed the probabilities toward a La Niña event for multiple years,” says John Fasullo, a climate scientist at the US National Center for Atmospheric Research and lead author of a new paper describing the modeling, which was published today in Science Advances. “This is actually—in terms of the historical records—one of the largest perturbations to the Southern Hemisphere that we've seen.”

COURTESY OF THE NATIONAL CENTER FOR ATMOSPHERIC RESEARCH

Check out the map above. As fires raged in Australia in December 2019, smoke (high concentrations are shown in red) blew not only across the Pacific Ocean but also wrapped around the Southern Hemisphere. Up in the atmosphere, those innumerable aerosol particles—charred plant material, even bits of structures that had burned—became little nuclei for water to condense upon. This is how clouds form normally, when water aggregates around dust particles. But in the Southern Hemisphere, there aren’t a whole lot of these nuclei blowing around. (In the Northern Hemisphere, there are more land masses to provide particulate matter.)

FEATURED VIDEO

 

“Having this huge source of the Australian wildfires actually had a big effect and created all these cloud condensation nuclei. And, in turn, that made the clouds brighter,” says Fasullo. 

COURTESY OF THE NATIONAL CENTER FOR ATMOSPHERIC RESEARCH",https://www.wired.com/story/the-weird-way-australias-bushfires-influenced-a-weirder-la-nina/,,,,,,,,
